{
  "schema_version": "1.0",
  "id": "manager-crash-resume",
  "shape": "manager+workers",
  "tier": "smoke",
  "seed": 3002,
  "failure_mode": "crash-resume",
  "fixture": {
    "pipeline": [
      { "step": "01-classify", "worker": "classify.js" },
      { "step": "02a-route-simple", "worker": "simple.js" },
      { "step": "02b-route-complex", "worker": "complex.js" },
      { "step": "03-finalize", "worker": "finalize.js" }
    ],
    "workers": {
      "classify.js": { "behavior": "ok", "delay_ms": 50 },
      "simple.js": { "behavior": "ok", "delay_ms": 50 },
      "complex.js": { "behavior": "ok", "delay_ms": 50 },
      "finalize.js": { "behavior": "ok", "delay_ms": 50 }
    },
    "manager_decisions": [
      { "after_step": "01-classify", "on_output": "simple", "next_step": "02a-route-simple" },
      { "after_step": "01-classify", "on_output": "complex", "next_step": "02b-route-complex" }
    ],
    "crash_after_step": "01-classify"
  },
  "expected": {
    "outcome": "crash-recovered",
    "completed_steps": ["01-classify", "02a-route-simple", "03-finalize"]
  },
  "invariants": [
    "no-duplicate-effects",
    "intent-before-effect",
    "no-step-reexecuted-after-resume"
  ]
}
