{
  "schema_version": "1.0",
  "id": "pipeline-normal",
  "shape": "pipeline",
  "tier": "smoke",
  "seed": 1001,
  "failure_mode": "normal",
  "fixture": {
    "pipeline": [
      { "step": "01-gather", "worker": "gather.js" },
      { "step": "02-process", "worker": "process.js" },
      { "step": "03-deliver", "worker": "deliver.js" }
    ],
    "workers": {
      "gather.js": { "behavior": "ok", "delay_ms": 50 },
      "process.js": { "behavior": "ok", "delay_ms": 50 },
      "deliver.js": { "behavior": "ok", "delay_ms": 50 }
    }
  },
  "expected": {
    "outcome": "complete",
    "completed_steps": ["01-gather", "02-process", "03-deliver"]
  },
  "invariants": [
    "no-duplicate-effects",
    "intent-before-effect",
    "all-checkpoints-fsyncd"
  ]
}
