{
  "schema_version": "1.0",
  "id": "pipeline-crash-resume",
  "shape": "pipeline",
  "tier": "smoke",
  "seed": 1002,
  "failure_mode": "crash-resume",
  "fixture": {
    "pipeline": [
      { "step": "01-gather", "worker": "gather.js" },
      { "step": "02-process", "worker": "process.js" },
      { "step": "03-deliver", "worker": "deliver.js" }
    ],
    "workers": {
      "gather.js": { "behavior": "ok", "delay_ms": 50 },
      "process.js": { "behavior": "ok", "delay_ms": 50 },
      "deliver.js": { "behavior": "ok", "delay_ms": 50 }
    },
    "crash_after_step": "01-gather"
  },
  "expected": {
    "outcome": "crash-recovered",
    "completed_steps": ["01-gather", "02-process", "03-deliver"]
  },
  "invariants": [
    "no-duplicate-effects",
    "intent-before-effect",
    "no-step-reexecuted-after-resume"
  ]
}
