{
  "schema_version": "1.0",
  "id": "fanout-halt-uncertain",
  "shape": "fan-out",
  "tier": "smoke",
  "seed": 2003,
  "failure_mode": "halt-uncertain",
  "fixture": {
    "pipeline": [
      { "step": "01-init", "worker": "init.js" },
      { "step": "02-merge", "worker": "merge.js" }
    ],
    "workers": {
      "init.js": { "behavior": "ok", "delay_ms": 50 },
      "worker-a.js": { "behavior": "ok", "delay_ms": 50 },
      "worker-b.js": { "behavior": "intent-no-complete", "delay_ms": 50 },
      "worker-c.js": { "behavior": "ok", "delay_ms": 50 },
      "merge.js": { "behavior": "ok", "delay_ms": 50 }
    },
    "fan_out_groups": [
      [
        { "step": "02a-branch", "worker": "worker-a.js" },
        { "step": "02b-branch", "worker": "worker-b.js" },
        { "step": "02c-branch", "worker": "worker-c.js" }
      ]
    ]
  },
  "expected": {
    "outcome": "halt",
    "completed_steps": ["01-init"],
    "halt_reason": "UNRESOLVED SIDE EFFECT"
  },
  "invariants": [
    "halt-on-intent-without-completion",
    "no-duplicate-effects",
    "intent-before-effect"
  ]
}
