{
  "schema_version": "1.0",
  "id": "manager-halt-uncertain",
  "shape": "manager+workers",
  "tier": "smoke",
  "seed": 3003,
  "failure_mode": "halt-uncertain",
  "fixture": {
    "pipeline": [
      { "step": "01-classify", "worker": "classify.js" },
      { "step": "02a-route-simple", "worker": "simple.js" },
      { "step": "02b-route-complex", "worker": "complex.js" },
      { "step": "03-finalize", "worker": "finalize.js" }
    ],
    "workers": {
      "classify.js": { "behavior": "ok", "delay_ms": 50 },
      "simple.js": { "behavior": "intent-no-complete", "delay_ms": 50 },
      "complex.js": { "behavior": "ok", "delay_ms": 50 },
      "finalize.js": { "behavior": "ok", "delay_ms": 50 }
    },
    "manager_decisions": [
      { "after_step": "01-classify", "on_output": "simple", "next_step": "02a-route-simple" },
      { "after_step": "01-classify", "on_output": "complex", "next_step": "02b-route-complex" }
    ]
  },
  "expected": {
    "outcome": "halt",
    "completed_steps": ["01-classify"],
    "halt_reason": "UNRESOLVED SIDE EFFECT"
  },
  "invariants": [
    "halt-on-intent-without-completion",
    "no-duplicate-effects",
    "intent-before-effect"
  ]
}
