{
  "schema_version": "1.0",
  "id": "pipeline-halt-uncertain",
  "shape": "pipeline",
  "tier": "smoke",
  "seed": 1003,
  "failure_mode": "halt-uncertain",
  "fixture": {
    "pipeline": [
      { "step": "01-gather", "worker": "gather.js" },
      { "step": "02-process", "worker": "process.js" },
      { "step": "03-deliver", "worker": "deliver.js" }
    ],
    "workers": {
      "gather.js": { "behavior": "ok", "delay_ms": 50 },
      "process.js": { "behavior": "intent-no-complete", "delay_ms": 50 },
      "deliver.js": { "behavior": "ok", "delay_ms": 50 }
    }
  },
  "expected": {
    "outcome": "halt",
    "completed_steps": ["01-gather"],
    "halt_reason": "UNRESOLVED SIDE EFFECT"
  },
  "invariants": [
    "halt-on-intent-without-completion",
    "no-duplicate-effects",
    "intent-before-effect"
  ]
}
